{
  "report_id": "rpt_daily_20260804_ru",
  "report_type": "daily",
  "language": "ru",
  "period": {
    "start": "2026-08-04T00:00:00Z",
    "end": "2026-08-05T00:00:00Z"
  },
  "as_of": "2026-08-05T19:25:00Z",
  "content_path": "reports/ru/daily/2026-08-04.md",
  "claim_ids": [
    "clm_20260804_baksheevka_control",
    "clm_20260804_cross_border_drone_raids_russia",
    "clm_20260804_fire_point_european_integration",
    "clm_20260804_fpv_radar_visibility_assessment",
    "clm_20260804_generalstaff_update_published",
    "clm_20260804_july_engagements_7922",
    "clm_20260804_kherson_video_location",
    "clm_20260804_kherson_war_crime_accusation",
    "clm_20260804_kyiv_shelter_capacity",
    "clm_20260804_no_vessels_almost_two_weeks",
    "clm_20260804_odesa_ports_no_alternative_quote",
    "clm_20260804_port_strikes_continued",
    "clm_20260804_road_rail_bridges_struck",
    "clm_20260804_ru_uav_interceptions_304",
    "clm_20260804_ru_uav_interceptions_320",
    "clm_20260804_turkey_navigation_safety_call",
    "clm_20260804_type_c_funds_access",
    "clm_20260804_ua_uav_shot_down_suppressed_117",
    "clm_20260804_zaluzhnyi_nato_criticism"
  ],
  "assessment_ids": [
    "asm_20260804_air_defense_counts",
    "asm_20260804_black_sea_navigation_exports",
    "asm_20260804_civil_defense_and_operational_metrics",
    "asm_20260804_cross_border_drone_raids",
    "asm_20260804_kherson_video_and_accusation",
    "asm_20260804_policy_industry_public_criticism",
    "asm_20260804_strike_and_control_claims"
  ],
  "claim_set_sha256": "7675dfa8238555c84a1bdbf8506778796b33896fab7c8510923c101f0f1cddcf",
  "record_status": "approved",
  "generated_at": "2026-08-06T04:39:00Z",
  "translation_of_report_id": "rpt_daily_20260804_en",
  "source_commit": "c26850d6d9af713bde7fb014723b518eb1f6874d"
}
