{
  "report_id": "rpt_daily_20260805_ru",
  "report_type": "daily",
  "language": "ru",
  "period": {
    "start": "2026-08-05T00:00:00Z",
    "end": "2026-08-06T00:00:00Z"
  },
  "as_of": "2026-08-06T07:29:00Z",
  "content_path": "reports/ru/daily/2026-08-05.md",
  "claim_ids": [
    "clm_20260805_guardian_attributed_additional_sanctions_request",
    "clm_20260805_guardian_attributed_air_defence_delay_criticism",
    "clm_20260805_guardian_attributed_more_air_defence_request"
  ],
  "assessment_ids": [
    "asm_20260805_guardian_support_request_attributions"
  ],
  "claim_set_sha256": "331a1434a9983e0cad38747806c62466b0c995189695e2b2d4e7276be678aa75",
  "record_status": "approved",
  "generated_at": "2026-08-06T09:01:00Z",
  "translation_of_report_id": "rpt_daily_20260805_en",
  "source_commit": "9d67be2ff45dbd3c3baab0b41a46f837976e4c04"
}
